{
  "$schema": "https://json-schema.org/draft/2020-12/schema",
  "type": "object",
  "required": ["candidate_id", "status", "source_hash", "candidate_hash", "evaluation"],
  "properties": {
    "candidate_id": {"type": "string", "minLength": 1},
    "status": {"enum": ["candidate", "awaiting_approval", "activated", "rejected", "rolled_back"]},
    "source_hash": {"type": "string", "pattern": "^[0-9a-f]{64}$"},
    "candidate_hash": {"type": "string", "pattern": "^[0-9a-f]{64}$"},
    "evaluation": {"type": "object"}
  },
  "additionalProperties": true
}
